{
  "$schema": "https://json-schema.org/draft/2020-12/schema",
  "$id": "https://github.com/kent-tokyo/veridict/schemas/compare-report.schema.json",
  "title": "veridict compare report",
  "description": "JSON output of `veridict compare` for a single --metric run. A multi-metric run instead produces multi-report.schema.json (a Vec of this shape plus an overall verdict) - see report.rs's Report/MultiReport split.",
  "type": "object",
  "additionalProperties": false,
  "required": [
    "schema_version",
    "verdict",
    "validity",
    "promotion",
    "metric",
    "baseline_count",
    "candidate_count",
    "paired_count",
    "effect",
    "confidence",
    "ci_low",
    "ci_high",
    "pass_above",
    "fail_below",
    "timeouts",
    "crashes",
    "invalid",
    "failure_breakdown",
    "reason",
    "estimated_additional_trials",
    "inconclusive_kind",
    "warnings",
    "data_quality"
  ],
  "properties": {
    "schema_version": {
      "const": 1,
      "description": "Identifies this strict report shape. Because additionalProperties is false, future emitted fields require an explicit schema-version compatibility review."
    },
    "verdict": { "$ref": "#/$defs/verdict" },
    "validity": {
      "$ref": "#/$defs/validity",
      "description": "Valid unless a --max-timeouts/--max-crashes/--max-invalid cap was breached, in which case verdict above is also forced to inconclusive - see FailureCaps in the Rust API."
    },
    "promotion": {
      "$ref": "#/$defs/promotion",
      "description": "The single go/no-go field: promoted only when validity is valid and verdict is pass."
    },
    "metric": {
      "type": "string",
      "enum": ["winrate", "mean-diff", "sign-test", "elo", "paired-elo", "quantile-diff", "relative-diff"]
    },
    "baseline_count": { "type": "integer", "minimum": 0 },
    "candidate_count": { "type": "integer", "minimum": 0 },
    "paired_count": { "type": "integer", "minimum": 0 },
    "effect": {
      "type": "number",
      "description": "Point estimate. Centered on 0 for winrate/sign-test and expressed in Elo points for elo/paired-elo; in the input's own units for mean-diff/quantile-diff; a ratio (0.05 = +5%) for relative-diff."
    },
    "confidence": { "type": "number", "exclusiveMinimum": 0, "exclusiveMaximum": 1 },
    "ci_low": { "type": "number" },
    "ci_high": { "type": "number" },
    "pass_above": { "type": "number" },
    "fail_below": { "type": "number" },
    "timeouts": { "type": "integer", "minimum": 0 },
    "crashes": { "type": "integer", "minimum": 0 },
    "invalid": { "type": "integer", "minimum": 0 },
    "failure_breakdown": { "$ref": "#/$defs/failure_breakdown" },
    "reason": { "type": "string" },
    "estimated_additional_trials": {
      "type": ["integer", "null"],
      "minimum": 0,
      "description": "Rough estimate of additional trials to reach a decisive verdict. null when already decided, zero trials, or the effect is inside the pass/fail threshold band (see docs/metrics.md). Exact (binary-searched against the real CI function) for winrate/sign-test/elo; an O(1/sqrt(n)) heuristic with a documented bias for paired-elo/mean-diff/quantile-diff/relative-diff."
    },
    "inconclusive_kind": {
      "type": ["string", "null"],
      "enum": ["noise", "directional", null],
      "description": "Sub-classifies an inconclusive verdict by whether the CI excludes zero: directional (a real, consistent-direction effect that just doesn't clear the pass/fail threshold) vs noise (the CI still straddles zero). null for pass/fail, and for an inconclusive verdict that isn't a real CI judgment (zero usable trials, or a failure-cap breach). See docs/metrics.md."
    },
    "warnings": {
      "type": "array",
      "items": { "type": "string" },
      "description": "Human-readable data-quality flags; never affects verdict. Structured counterpart is data_quality."
    },
    "data_quality": { "$ref": "#/$defs/data_quality" },
    "quantile": {
      "type": "number",
      "exclusiveMinimum": 0,
      "exclusiveMaximum": 1,
      "description": "The quantile quantile-diff measured (e.g. 0.95 for p95). Present only for metric quantile-diff; omitted entirely (not null) for every other metric."
    },
    "cluster_count": {
      "type": "integer",
      "minimum": 0,
      "description": "--cluster-by-id only (winrate/elo): number of distinct resampling clusters. Omitted entirely (not null) when --cluster-by-id wasn't requested."
    },
    "max_cluster_size": {
      "type": "integer",
      "minimum": 0,
      "description": "--cluster-by-id only: the largest single cluster's record count."
    },
    "effective_sample_size": {
      "type": "number",
      "minimum": 0,
      "description": "--cluster-by-id only: paired_count deflated by design_effect (Kish 1965) - how many truly independent trials this clustered data is actually worth."
    },
    "design_effect": {
      "type": "number",
      "minimum": 0,
      "description": "--cluster-by-id only: Var(cluster bootstrap) / Var(i.i.d. bootstrap) on the same pooled data. 1.0 means no measurable clustering effect."
    },
    "scale_diagnostics": { "$ref": "#/$defs/scale_diagnostics" },
    "tied_count": {
      "type": "integer",
      "minimum": 0,
      "description": "relative-diff only: count of ingested records where candidate == baseline exactly, counted before any --paired-by-id netting. Omitted entirely (not null) for every other metric. See data_quality.diluted_by_ties."
    },
    "pair_score_counts": { "$ref": "#/$defs/pair_score_counts" },
    "correction_method": {
      "type": "string",
      "enum": ["bonferroni", "holm"],
      "description": "Present only when `compare --claim-correction bonferroni|holm` (or its deprecated --correction alias) was requested for this run; omitted entirely (not null) otherwise, so a default run's JSON is byte-identical to before this field existed."
    },
    "family_size": {
      "type": "integer",
      "minimum": 1,
      "description": "Number of --metric flags in this run's family; present only alongside correction_method. A family containing mean-diff/quantile-diff/relative-diff (no closed-form CI to correct against) or run with --cluster-by-id is rejected outright as a configuration error instead of being counted with a partial guarantee."
    },
    "achieved_alpha": {
      "type": "number",
      "exclusiveMinimum": 0,
      "description": "Smallest one-sided significance at which this report's own CI would still pass, in the same units as (1 - confidence). Present only for a report whose own verdict was pass."
    },
    "adjusted_alpha_threshold": {
      "type": "number",
      "exclusiveMinimum": 0,
      "description": "The corrected significance threshold achieved_alpha was actually compared against (alpha/family_size for bonferroni; alpha/(family_size-rank+1) for holm). Present exactly when achieved_alpha is."
    },
    "unadjusted_verdict": {
      "$ref": "#/$defs/verdict",
      "description": "Deprecated compatibility alias for verdict, present only alongside correction_method. Before 0.14.0, verdict itself became the *adjusted* value once correction ran, and this field held the pre-correction one alongside it; verdict is never adjusted now, so this always just equals it. New consumers should read verdict directly - see family_adjusted_verdict for the actual corrected claim. Scheduled for removal alongside a future schema_version bump."
    },
    "family_adjusted_verdict": {
      "$ref": "#/$defs/verdict",
      "description": "This metric's verdict, read as one claim among the family's simultaneous per-metric claims: a pass downgraded to inconclusive if it doesn't clear its corrected significance threshold, otherwise the same value as verdict. Computed after any FailureCaps have already been applied. Present only alongside correction_method; verdict above is never adjusted by correction."
    },
    "family_adjusted_promotion": {
      "$ref": "#/$defs/promotion",
      "description": "Promotion::decide(validity, family_adjusted_verdict) - whether this metric's improvement claim survives being considered alongside the rest of the family, separate from promotion above (the deployment gate, never touched by correction). Present exactly when family_adjusted_verdict is."
    }
  },
  "$defs": {
    "verdict": {
      "type": "string",
      "enum": ["pass", "fail", "inconclusive"]
    },
    "validity": {
      "type": "string",
      "enum": ["valid", "invalid"]
    },
    "promotion": {
      "type": "string",
      "enum": ["promoted", "not_promoted"]
    },
    "failure_counts": {
      "type": "object",
      "additionalProperties": false,
      "required": ["timeout", "crash", "invalid"],
      "properties": {
        "timeout": { "type": "integer", "minimum": 0 },
        "crash": { "type": "integer", "minimum": 0 },
        "invalid": { "type": "integer", "minimum": 0 }
      }
    },
    "failure_breakdown": {
      "type": "object",
      "additionalProperties": false,
      "required": ["baseline", "candidate"],
      "properties": {
        "baseline": { "$ref": "#/$defs/failure_counts" },
        "candidate": { "$ref": "#/$defs/failure_counts" }
      }
    },
    "pair_score_counts": {
      "type": "object",
      "additionalProperties": false,
      "required": ["score_0_0", "score_0_5", "score_1_0", "score_1_5", "score_2_0"],
      "description": "paired-elo only: complete-pair counts by combined candidate score. Omitted for every other metric.",
      "properties": {
        "score_0_0": { "type": "integer", "minimum": 0 },
        "score_0_5": { "type": "integer", "minimum": 0 },
        "score_1_0": { "type": "integer", "minimum": 0 },
        "score_1_5": { "type": "integer", "minimum": 0 },
        "score_2_0": { "type": "integer", "minimum": 0 }
      }
    },
    "data_quality": {
      "type": "object",
      "additionalProperties": false,
      "required": ["tiny_sample", "high_failure_rate", "draw_heavy", "effect_within_noise_floor", "low_id_diversity", "thin_quantile_tail", "wide_baseline_scale", "diluted_by_ties"],
      "properties": {
        "tiny_sample": { "type": "boolean", "description": "paired_count < 30" },
        "high_failure_rate": { "type": "boolean", "description": "over 20% of trials failed to execute" },
        "draw_heavy": { "type": "boolean", "description": "elo only; always false for other metrics. Over 50% draws." },
        "effect_within_noise_floor": { "type": "boolean", "description": "abs(effect) < CI half-width, guarded by !tiny_sample" },
        "low_id_diversity": { "type": "boolean", "description": "one id repeated >= 3 times among >= 10 id-tagged trials, unpaired mode only; always false when --paired-by-id is set or too few records carry an id" },
        "thin_quantile_tail": { "type": "boolean", "description": "quantile-diff only; always false for other metrics. Fewer than 10 expected observations (paired_count * min(quantile, 1-quantile)) in the thinner tail." },
        "wide_baseline_scale": { "type": "boolean", "description": "mean-diff only; always false for other metrics (including relative-diff, which ships scale_diagnostics for transparency but never warns about itself). True when positive baselines span at least WIDE_BASELINE_SCALE_ORDERS (1.0) orders of magnitude - see scale_diagnostics and docs/metrics.md." },
        "diluted_by_ties": { "type": "boolean", "description": "relative-diff only; always false for other metrics, and always false under --paired-by-id (the pre-netting/post-netting count mismatch there is an unbounded skew, not a small approximation). True when tied_count / baseline_count >= TIE_DILUTION_FRACTION (0.5) - see tied_count and docs/metrics.md." }
      }
    },
    "scale_diagnostics": {
      "type": "object",
      "additionalProperties": false,
      "required": ["positive_baseline_count", "non_positive_baseline_count", "min_positive_baseline", "max_positive_baseline", "raw_orders_of_magnitude", "robust_orders_of_magnitude"],
      "description": "mean-diff/relative-diff only. Computed from baseline values alone - never candidate, effect, CI, or verdict - so it can never be tuned by, or reveal, the observed result.",
      "properties": {
        "positive_baseline_count": { "type": "integer", "minimum": 0 },
        "non_positive_baseline_count": { "type": "integer", "minimum": 0, "description": "Always 0 for relative-diff, which hard-rejects any non-positive baseline before this diagnostic would ever be computed." },
        "min_positive_baseline": { "type": "number" },
        "max_positive_baseline": { "type": "number" },
        "raw_orders_of_magnitude": { "type": "number", "description": "log10(max_positive_baseline / min_positive_baseline)." },
        "robust_orders_of_magnitude": {
          "type": ["number", "null"],
          "description": "log10(p95 / p05) over positive baselines. Present only once there are at least 20 of them (see ROBUST_SPAN_MIN_POSITIVE_BASELINES) - null otherwise."
        }
      }
    }
  }
}
